account,name,link,keywords,language
@emiller@genomic.social,Edmund Miller,https://genomic.social/@emiller,nfcore nascent functional_genomics julia,en
@alex_peltzer@genomic.social,Alex Peltzer,https://genomic.social/@alex_peltzer,nfcore cloud_computing oncology immunology aDNA,en/en
@raw937@genomic.social,,https://genomic.social/@raw937,Synthetic Virologist,en
@drew_kt@genomic.social,Drew thompson,https://genomic.social/@drew_kt,undergrad bioinformatics + oncology,en
@lucacozzuto@genomic.social,Luca Cozzuto,https://genomic.social/@lucacozzuto,nextflow ngs R python,en/ita/es
@RikeHanssen@genomic.social,Friederike Hanssen,https://genomic.social/web/@RikeHanssen,PHD Student nf-core cloud_computing oncology
